url,subreddit,author_name,created,title,score,upvote_ratio,content,result
https://www.reddit.com/r/ApplyingToCollege/comments/hmkdlg/is_the_use_of_college_app_essay_help_services_eg/,applyingtocollege,throwaway4738495,1594111474,Is the use of college app essay help services (e.g. CollegeVine) considered cheating?,0,0.5,"Hello, I wrote my first draft of my Common App Personal Essay, and I submitted it to CollegeVine to get some feedback. I told my parents about this, and they are worried that this is considered cheating. Did I overstep a boundary by having somebody help me on the essay? What is (and isn’t) allowed? I would like to get feedback on my second draft, but I want to make sure I am following the rules.

Thank you!",0
https://www.reddit.com/r/ApplyingToCollege/comments/hmk9nh/i_have_depression_and_covid19_is_literally/,applyingtocollege,Odd-Adhesiveness-622,1594111061,"I have depression, and COVID-19 is literally killing me...",75,0.93,"I hoped and prayed, but it looks like fall semester will be online for most of us after all. And even for those that have in-person classes, we’ll hardly be able to make friends, or interact with other people. There won’t be any clubs, there surely won’t be any sports. It’ll be some dystopian vision of the future come to life. People spaced 10 desks apart, gloved and masked, taking notes from a professor screen-casting into the room.

I was looking forward to college. I haven’t been to school in years— not since 6th grade —but somehow I got into college. The biggest reason I applied was not even to further some future career, but because I am incredibly lonely. Maybe that makes me sound weak or soft, but you don’t know how it feels. My parents are crazy, literally insane. I haven’t left the house in years. I have no friends, no one to talk to, nothing to look forward to. I literally sit inside the house all day. The lights off, the curtains shuttered. My father drinks heavily, so we have to keep the house dark for him— he say’s it “hurts his head”. I’m a literal hand-maid. I spend all day fetching things for people or cooking or cleaning. My grandfather, who lives with us, has an extensive collection of hand guns I have to look after. They need oiling twice a week.

They tried to stop me from going to college. They destroyed my social security card and my birth certificate, and I spent months fighting to get ahold of new copies. When they realized I was progressing, they did everything they could to convince—or scare—me into going to community college part-time so I could stay at home most days, instead of moving out of state.

I felt proud when I started receiving acceptances. I was excited to learn some of my best financial aid offers were from really nice out-of-state schools. And, most of all, I was excited to forget about everything in the past and overcome depression. Now, I know a lot of people these days claim to have depression. Most people don’t know \*real\* depression. I feel completely unmotivated. I can hardly push myself to do anything. It’s like being exhausted, but a million times worse. Some days I can’t sleep, other days I can hardly wake up. I can’t eat. For some time I was barely 110 lbs yet a smidge over 6 foot tall. I don’t have suicidal thoughts— I have the everyday realization that if I just wrapped an extension cord over the door I wouldn’t have to face tomorrow.

I just want a life. I want my own friends, like my siblings do. Like the other kids across the street. Like every other 19-year-old in America. I was almost there, and only months from finally getting the only thing I ever wanted in life, a new age of “social distancing” is ushered in. Half the year will be in person, but there will hardly be anything personal about it. The other half I’ll have to do online. I don’t even know how i’ll pull that off, here at home.

I can’t handle another year of this. I just want a normal life for one day. I’d do anything for one day.",0
https://www.reddit.com/r/ApplyingToCollege/comments/hmk4wq/was_the_2020_bank_of_america_student_leaders/,applyingtocollege,satellitemaestro,1594110578,Was the 2020 Bank of America Student Leaders program cancelled?,0,0.5,Title! Or did it shift to a virtual program?,0
https://www.reddit.com/r/ApplyingToCollege/comments/hmk2bz/help/,applyingtocollege,nylhsac,1594110303,help,1,0.67,"hey guys ive been looking and learning alot about target and safety schools and how i should def have them... does anyone have some less prestigious colleges for hopefully psychology/philosophy majors? ik this is super specific but the internet always puts harvard, Stanford and t20s as the best psychology programs and im looking for something a little more obtainable LOL. thanks guys",0
https://www.reddit.com/r/ApplyingToCollege/comments/hmk25h/unc_charlotte_to_nc_state_transfer/,applyingtocollege,_YouSaidWhat,1594110283,UNC Charlotte to NC State transfer,0,0.5,"As a Comp Sci major, anyone transferred from UNCC Freshman year to NC State Sophomore year? If so, what classes did you take to transfer, how hard was it, and how competitive was it as an applicant?",0
https://www.reddit.com/r/ApplyingToCollege/comments/hmjtxu/how_do_i_know_when_a_university_releasesupdates/,applyingtocollege,CalGal4Evah,1594109404,How do I know when a university releases/updates their prompts for the 2021 fall admissions cycle?,1,0.67,"A lot of schools currently have a writing supplement prompt listed on their website, but it doesn't specify the admissions cycle year. How do I know if those prompts are the ones for 2021? Do schools usually announce it in some way? Is it compiled somewhere (like a website that updates prompts for 2021)?

I know Georgia Tech just recently announced that they updated their prompts, but I stumbled on that while looking through their website. Is there a standard way to check rather than poking around the university's admissions website from time to time?",0
https://www.reddit.com/r/ApplyingToCollege/comments/hmjs24/language_study_looks_good_on_apps_t20s/,applyingtocollege,EnjoyingExistence,1594109224,Language study looks good on apps? (T20's),1,0.67,"So the narrative of my applications will be almost entirely politics and government-based, but all of my   former activities in that field require person to person in my area, so quarantine is really cutting into my internship time. I've started self-studying Spanish and Mandarin, and am just wondering how good that looks on an application to a school like Dartmouth or Harvard if I don't really take either language beyond just individual study?",0
https://www.reddit.com/r/ApplyingToCollege/comments/hmjrar/is_it_still_possible_that_cb_will_cancel_the_sat/,applyingtocollege,Able_Present,1594109145,is it still possible that CB will cancel the SAT,1,0.67,above,0
https://www.reddit.com/r/ApplyingToCollege/comments/hmjpxk/sending_in_official_transcript/,applyingtocollege,humhllelujah,1594109009,Sending in Official Transcript?,0,0.5,"I applied to the University of Kansas last Wednesday and I submitted a copy of my transcript that my GC had sent me after I requested it under the “unofficial transcript” portion of the application, but the application also said to send in an official copy of it to the admissions office as soon as possible. How would I go about doing that? And would I wait until after admission? I’m assured admission w/ my current stats so I’m not too worried about that, I just want to make sure I’m doing this right 🥴",0
https://www.reddit.com/r/ApplyingToCollege/comments/hmjg1m/any_recent_high_school_grads_who_have_chosen_to/,applyingtocollege,Muted-Theory,1594108016,Any recent high school grads who have chosen to defer a year/ are considering it,10,0.92,"Idk if its just me but I always kinda wanted to take a gap year and covid rlly forced me to debate the pros/cons of one and have ultimately decided its my best option as of now. I've talked to a bunch of people who are in similar situations and since everyones scared admission for next years cycle will be harder because of all the deferrals, I wanted to see how many of yall are actually deferring? feel free to pm if you are taking a gap year and want to talk :)) ",0
https://www.reddit.com/r/ApplyingToCollege/comments/hmj7j4/umich_waitlist/,applyingtocollege,Dolphin123455,1594107183,UMich Waitlist??,1,0.6,"I'm committed to another school already, but I'm still on the waitlist for umich-- they haven't even sent me a rejection yet. I thought they'd let me know by late June, but I guess not. Should I just assume it's a rejection which they just haven't sent me?",0
https://www.reddit.com/r/ApplyingToCollege/comments/hmj692/failed_class_in_last_semester_am_i_screwed/,applyingtocollege,SnooMachines2910,1594107063,"Failed class in last semester, am I screwed?",2,0.75,"So I just failed a spanish class in my last semester of high school because I didn't do anything, and i still graduated but I have the option of doing summer school to potentially pass this class. Should I do it, and would this even affect my college given the circumstances atm?",0
https://www.reddit.com/r/ApplyingToCollege/comments/hmiw84/thread_for_vibes_of_t20s/,applyingtocollege,spitecranberry,1594106110,thread for vibes of T20s!,13,0.93,"# what kind of vibes do these schools give off?

*What are the students like? Do they value humanities, internships, sports, STEM? What does the campus revolve around? What makes each of these schools different, besides their academics?*

Given COVID-19, it's kinda hard to get that knowledge of what the atmospheres of different colleges are like if you can't even visit them. Don't get me wrong here, virtual visits are definitely useful, but it doesn't really replace in-person ones. 

Comment down below with your thoughts on what the vibes of different T20s! *(i'm mainly saying T20s just to sharpen the focus a little of this post but feel free to add others)*",0
https://www.reddit.com/r/ApplyingToCollege/comments/hmij18/does_anyone_know_if_the_uc_application_will_have/,applyingtocollege,alphawater1001,1594104849,Does anyone know if the UC application will have a COVID essay?,1,0.67,\^,0
https://www.reddit.com/r/ApplyingToCollege/comments/hmie8c/making_videos_about_how_you_got_into_a_college/,applyingtocollege,god12345lord,1594104392,Making videos about how you got into a college when you haven't even attended the first day 🤡,10,0.82,"Like how're you supposed to know you got into Stanford, even without attending the Fall quarter. It's all just speculation. ",0
https://www.reddit.com/r/ApplyingToCollege/comments/hmhxsp/the_correct_top_20_list/,applyingtocollege,jklover25,1594102920,The correct top 20 list,0,0.27,"1) Harvard 
2) Stanford 
3) MIT
4) Yale 
5) Princeton 
6) UPenn 
7) Brown 
8) Duke 
9) Columbia 
10) UChicago
11) Caltech 
12) Dartmouth 
13) Cornell
14) Northwestern 
15) JHU 
16) Rice 
17) Notre Dame
18) Vanderbilt 
19) WashU 
20) UC Berkeley",0
https://www.reddit.com/r/ApplyingToCollege/comments/hmeygl/is_my_essay_idea_okay/,applyingtocollege,throwaway127623454,1594093465,Is my essay idea okay?,7,0.82,"I'm trying to draft out my common app essay rn and I can't decide how I feel about this idea. Basically, I danced ballet for 11 years recreationally. funny thing is, I'm not at all naturally inclined to the art (i'm weak, i have terrible muscle memory, and hardly any musicality) but i LOVED to dance. I want to talk about how I pushed through comparing myself to other dancers and how dance helped me to develop my grit. but i also want to explain that the reason i was so passionate about dance in the first place was because it opened my mind to how so many, seemingly disconnected things, can link together to form a beautiful work of art (basically the little nerd in me loves that to dance well you need to understand how your muscles move, the physics behind momentum and balance, even the literature and history that molded dance into what it is today). Is this appropriate? Too broad (I was thinking about narrowing it down but i think it might dilute my experience)? Feedback would be greatly appreciated! Thanks!",0
https://www.reddit.com/r/ApplyingToCollege/comments/hmgmlb/how_do_i_turn_my_love_for_reading_into_an/,applyingtocollege,its_snot_funny,1594098707,How do I turn my love for reading into an extracurricular?,17,0.95,"So I read a lot. At this point i’m not even sure if I like it, but I read more than sixty books a year. I read classics, thrillers, biographies, mysteries, literally anything for fun. Most of the books that I am forced to read for school I’ve already read before on my own time.

Unless I write reviews or something, there’s no tangible evidence to back up any of my claims. Plus just saying “i like to read lol” sounds super lame. I was part of my school’s book club freshman year but now there’s like 2 people in it and most people are too pressed about school to read for fun. 

Any ideas?? It’s a hobby that takes up a good amount of time, but I basically don’t know what to do with it.",0
https://www.reddit.com/r/ApplyingToCollege/comments/hmhlck/what_will_happen_with_co_2025_acceptances_next/,applyingtocollege,alp-02,1594101807,What will happen with c/o 2025 acceptances next year?,18,0.8,"It seems that so many 2024s are considering deferring admission into next year, which would take away potential spots for current rising seniors. Will colleges let them do this? Im hoping unis just decide to only let a select few with specific goals/plans for a gap year defer their admission or else nearly all of c/o 2024 is going to take up the spots in 2025s class. Or maybe colleges will increase the number of students in the class of 2025 just to make up for this (though this seems the most unlikely outcome).

Anyone other rising seniors scared out of their minds ab this???

So far, I have only heard of one prefrosh (he was Emory 2024 but now he's 2025) taking a gap year. But he is doing it bc he got into some really cool study abroad program. 

Well, I just wanted to hear what you guys think or have heard. Thanks!!!",0
https://www.reddit.com/r/ApplyingToCollege/comments/hmhhow/recs/,applyingtocollege,Run-Embarrassed,1594101498,recs,4,0.83,my college list is pretty long and i'm worried asking my teacher for recs for all of them would annoy her. usually teachers recyle one letter right?,0
https://www.reddit.com/r/ApplyingToCollege/comments/hmhf7r/how_to_prove_volunteering_hoursjob_hours_on/,applyingtocollege,lockian76,1594101280,How to prove volunteering hours/job hours on common app?,0,0.5,"I heard that common app is based on self report and if you get caught on lying you may get rescind, but how could college know about that?

I'm from a low-income family so I work apprx 30hrs/week, and have done tons of free tutors during school days and community service but I haven't reported to school because school never really told me how to. Am I screwed if I didn't report my voulnteering hours??",0
https://www.reddit.com/r/ApplyingToCollege/comments/hmh7xn/ib_grades_for_rising_seniors/,applyingtocollege,TheFlyingEmperor,1594100632,IB grades for rising seniors,0,0.5,"Will universities understand that the grades this year for IB were kind of messed up (i.e. no exams)? I think pretty much everyone I knew who was predicted 7 got a 6 this year, in big part due to the heavy reliance on IAs this year...",0
https://www.reddit.com/r/ApplyingToCollege/comments/hmh67p/i_got_suspended_in_freshman_year_and_i_dont_know/,applyingtocollege,Exciting-Ant-9580,1594100470,I got suspended in freshman year and I don't know what to do.,12,0.88,"I said something nasty to someone else freshman year and they took it as a violence threat and I ended up getting suspended for the rest of the day. That was so long ago, and I have been researching on the internet about it affecting college apps. They make it seem like I am done for. I didn't hurt anyone and I had no intention for it. I am trying to move on past it. I have good grades and good standardized test scores. I truly feel sorry for what I did, I just don't know what to do, I just feel like my life is over. Any help would be appreciated. Thank you.",0
https://www.reddit.com/r/ApplyingToCollege/comments/hmh46k/ice_announces_that_any_international_students_who/,applyingtocollege,ericjix13,1594100285,ICE announces that any international students who are enrolled in a university that will be online this fall must transfer or leave the US.,16,0.86,Implications? I personally know a lot of my friends at harvard are considering deferring their enrollment because they don’t want to pay full tuition for an online education. One of my international friends has already had to defer this morning.,0
https://www.reddit.com/r/ApplyingToCollege/comments/hmh1im/thinking_about_reapplying_this_fall_and_want_to/,applyingtocollege,StellarStarmie,1594100055,Thinking about reapplying this fall and want to discuss essay topics,1,0.67,"One of the things I can honestly not do well is communicating to people what I want to say. This is because I am on the autism spectrum.

I started brainstorming potential essay topics this past week and one of them I came across was ""dad jokes."" Dad jokes came about because I wanted to show someone I can communicate with someone meaningfully. Is it a ""good"" essay topic to write about and if so, how common is it?",0
https://www.reddit.com/r/ApplyingToCollege/comments/hmgy6h/i_didnt_get_anything_done_today/,applyingtocollege,ProudTyy,1594099763,I didn't get anything done today,37,0.93,QAQ,0
https://www.reddit.com/r/ApplyingToCollege/comments/hmgxfm/ignore_this_i_made_this_post_to_get_the_essay_bot/,applyingtocollege,JellyybeeAN,1594099696,Ignore this: I made this post to get the essay bot to comment,258,0.97,I dont know which one,0
https://www.reddit.com/r/ApplyingToCollege/comments/hmgsen/my_international_fall_of_2020_gang_what_are_you/,applyingtocollege,wotifidontgetacceted,1594099246,My international fall of 2020 gang what are you doing? I got some not so good news,6,0.87,https://www.ice.gov/news/releases/sevp-modifies-temporary-exemptions-nonimmigrant-students-taking-online-courses-during,0
https://www.reddit.com/r/ApplyingToCollege/comments/hmgmja/ice_says_international_students_whose/,applyingtocollege,ChaosTheory22,1594098701,ICE says international students whose universities move to online-only this fall must transfer or leave the U.S (see link),868,0.99,"https://www.ice.gov/news/releases/sevp-modifies-temporary-exemptions-nonimmigrant-students-taking-online-courses-during

Edit: u/leveredge_group has created a spreadsheet to track which schools have an online or hybrid policy. Feel free to add to it if you have info. Here is the link: https://docs.google.com/spreadsheets/d/1ALGoq9424HyiydEbNbrWXYM3HWetSh6a8iRZv_JSy2s/edit?usp=sharing",0
https://www.reddit.com/r/ApplyingToCollege/comments/hmg5ha/question_about_stats_vs_ecs/,applyingtocollege,rsepetal,1594097187,question about stats vs. ecs?,1,0.6,"hey! this is my first post on this sub, so please bear with me if i've messed something up.

i'm looking to get some more perspectives on a question about admissions that's been bugging me for a while. i'm a rising senior with really good stats (1600, 36, 4.0, 12 aps with 6 5s so far and waiting on 5 from junior year) but mediocre ecs (president of math honor society and regional success in math team & debate are my main ones plus a few other scattered leadership roles and instruments, as well as a part-time job). i certainly don't have the prestigious resume of some of the people on the chance me sub.

i've been worried for a while about my ecs weighing my app down, particularly considering covid and the impact it's had on admissions. my parents and friend say that perfect test scores are a unique circumstance and that colleges will value them more, but i'm not so sure about that -- what are your opinions?

(edit: my question is about the validity of the statement that “two perfect scores are categorically different than a 1590 and a 36 or either perfect score alone.” sorry if that was unclear!)",0
https://www.reddit.com/r/ApplyingToCollege/comments/hmg1va/is_it_worth_it_to_go_to_an_elite_university_for/,applyingtocollege,i-am-v-sleepy,1594096868,Is it worth it to go to an 'elite' university for an English major?,9,1,"I'm interested in going for an English degree at a private T20 school, but I'm not sure if it's worth to go under so much debt for an English major. I'm not going to be eligible for financial aid (I think) because I'm middle class, but at the same time, I won't be able to afford 200k + in debt. As an English major, the career I'll be pursuing is probably not going to be very high paying either. I have a college in mind that I think is a perfect fit for me because it's everything I really want in a school, but the financial factor is making me rethink whether or not I should apply. Should I just stick with my state school? Or should I go for it? Under what circumstances do you think would make the debt 'worth it'? Any advice would be greatly appreciated!!",0
https://www.reddit.com/r/ApplyingToCollege/comments/hmg1bb/what_are_your_top_5_musthaves_in_a_college_or/,applyingtocollege,Admissions_Geek,1594096822,What are your top 5 must-haves in a College or University?,60,0.97,"**What are the five most important things (to you) in a College or University?** (ex. proximity to an airport, access to music practice rooms for non-music majors, etc.)

**What traits, if any, are deal-breakers?** (ex. geographic location, no guaranteed housing for freshman, etc.)",0
https://www.reddit.com/r/ApplyingToCollege/comments/hmg06n/list_an_ec_as_a_internship_or_a_program/,applyingtocollege,IndividualBeliefs,1594096719,List an EC as a internship or a program?,19,0.96,"I got into a selective, 15 students per year, journalism bootcamp that has us do interviews and write articles. The written articles will be published in that newspaper which serves two counties, and we are being paid for the 2 week ""program""/internship

When being paid, the person paying us said ""We [the newspaper staff] know finding unpaid internships in journalism is hard enough, and paid ones are even harder to find. We have choosen to pay you guys, because we know that a paid internship will make you [the students] feel like the effort isn't going to waste"" and to know that they value our time that could be spent elsewhere. 

Due to that, I asked if it could be listed as an internship since they said it was a paid internship and they said yes but I'm not 100% sure if I should. It was listed as a journalism bootcamp, under the name of ""(X newspaper) media project"", so I don't know IF AO's will think I'm lying if I list it as an internship when it's listed as a program with a stipend, or is a program with a stipend like this technically an internship?",0
https://www.reddit.com/r/ApplyingToCollege/comments/hmfqpi/has_anyone_tried_doing_college_tours_in_vr/,applyingtocollege,bshields235,1594095898,Has anyone tried doing college tours in VR?,10,0.92,"I found a website called YouVisit, and basically they have a catalog of college tours in VR you can do on your phone. I’m thinking about getting like a $30 pair of VR goggles to slide my phone into and see how that goes.",0
https://www.reddit.com/r/ApplyingToCollege/comments/hmfohw/playing_kpop_while_stressing_about_apps_is_the/,applyingtocollege,vaicykkkkk,1594095693,playing kpop while stressing about apps is the most satisfying thing.,33,0.87,"writing this while listening to loser by big bang. and wow it hits in the feels.

if u have song suggestions, send them in!

edit: i guess i should put my playlist on here as well! 

\- bts. sorry but i love them

\- sunmi's warning album is the best

\- iu. she's so soothing

\- winner (like, all their songs)

\- pentagon

\- bigbang (especially taeyang's solos)",0
https://www.reddit.com/r/CasualConversation/comments/hms20j/i_am_eagerly_resisting_the_urge_to_check_my_email/,CasualConversation,butterwoman18,1594146536,"I am eagerly resisting the urge to check my email as am about to receive the counter job offer from a company, I dreamt of working for.",1,0.99,"Its recession in my country and its hard to hear about the job offers, nowadays. 3 weeks back, I received a LinkedIn text with a company which is solving the exact problem, I love [Can't reveal much details]. 

I gave them my number for the salary which they offered to me, last Friday. Now I am checking my email every now and then to see if they have responded. Although, I am trying really hard to not follow up and let them come back to me. I am fearing that they wouldn't agree on the offer and not extend one. I don't want to lose this opportunity, though. Its a pretty good work than what I am doing at my present company. 

Any opinions on this?",0
