url,subreddit,author_name,created,title,score,upvote_ratio,content,result
https://www.reddit.com/r/depression/comments/cpidz8/depression_for_me_is_a_constant_feeling_of/,depression,presti-ravioli,1565671820,"Depression for me is a constant feeling of wanting to go home, but no matter where I am, I am never home. Even when I’m at my physical home.",9473,1,"It’s a constant sense of wanting to go somewhere else. I’d feel better if i was at this place. Then you go there and then it’s the same exact feeling, just in a different physical location. 

I feel mentally homeless and I just want to go home.


Edit: I didn’t think this would get traction and that’s my first gold. Thanks buddy.",1
https://www.reddit.com/r/depression/comments/c2fuf3/depression_is_so_much_worse_if_you_live_with_your/,depression,niszi,1560972308,Depression is so much worse if you live with your parents.,7750,1,"I can't hide, I can't cry out loud, they don't understand me if I can't clean my room or can't go out. They watch me fall apart and criticise me while it happens.",1
https://www.reddit.com/r/depression/comments/cd0hjp/shout_out_to_the_particular_hell_that_is/,depression,fallen-fawn,1563119620,Shout out to the particular hell that is functional depression.,6625,1,"This is me. Don’t get me wrong, it’s better than don’t-leave-my-bed-for-a-week depression. I am grateful I can be an independent person. But there is something uniquely horrible about being able to go to work every day, occasionally clean up after yourself, pay your bills, generally put yourself together enough to look like a human being... but that’s it. Nothing else. No social life. No hobbies. Constantly battling your mind. And being absolutely fucking exhausted all the time.",1
https://www.reddit.com/r/depression/comments/7k1nt2/a_stranger_just_saved_my_life/,depression,,1513392029,A stranger just saved my life...,5941,0.99,"I woke up today wanting to die. I was planning on doing it after school so I decided school was pointless to go to. I walked to the mall by my school and went to a Kneader's and ordered french toast. French toast has always been my favorite so I figured it would be a good last thing to eat. I pondered a ton about my life and what it is I really want. I felt super empty but also my mind was racing with thoughts. I had convinced myself I needed to finish my life today. I had been thinking for about half an hour when an elderly man sat across from me and gave me a hot chocolate. He said that he ordered it for me because he could tell I needed it. He told me ""I don't know what you're going through, but life will get better."" And then he left. And then I cried. And now I'm back at school, and I think I want to live. 

Edit: Thank you to everyone who responded to this and messaged me and just were so kind. <3 ",1
https://www.reddit.com/r/depression/comments/bsrdr0/i_was_going_to_kill_myself_tonight/,depression,,1558793770,I was going to kill myself tonight,5160,0.99,"I wrote a suicide note earlier in the morning. I spent most of the day doing things that used to make me happy: getting coffee, walking in the park, listening to music, etc. I ate my “last meal” while listening to Bob Marley.

About an hour before I was going to kill myself, my friend from college messaged me and asked to play Xbox. We ended up reminiscing on good times, and laughing our asses off. It felt nice to feel like somebody cared about me. We’re planning on playing tomorrow too.

I don’t feel as bad as I did earlier today and I also am glad that I didn’t kill myself.

Edit: thank you for the gold, friend:)

Edit: thank you for the silver, friend:) I’m currently sitting at a coffee shop, reading all the kind messages everyone has sent. It means a lot to me",1
https://www.reddit.com/r/depression/comments/b7fxrm/does_anyone_ever_feel_okay_for_a_while_then_a/,depression,Whiteelchapo,1554008344,"Does anyone ever feel okay for a while, then a wave of depression just hits you like a truck?",5061,1,"Recently I thought I was beginning to feel better. Not quite happy, but just sort of... I don’t know, content? But my depression always seems to come back, sometimes stronger than others. This has happened in the past too. I’m worried that one day the gust of depression will blow too strongly and the branch i’m hanging onto will snap. Or maybe not. That could just be the apathy speaking though. Anybody else really frustrated by this? It feels like i’m always walking a razors edge between being fine, and being depressed and one misstep causes me to lose my balance. Ugh. 

Edit: evidently, there are quite a few people who experience similar feelings. I just want to say that it makes me happy in a sad sort of way to know that we are all going through something similar in our lives. It makes things less lonely.",1
https://www.reddit.com/r/depression/comments/ch5k91/living_with_depression_is_like_running_a_marathon/,depression,Jadenent0623,1563986454,"Living with depression is like running a marathon with a broken leg and then having everyone run past you and say “Yeah, yeah, broken leg boo-hoo, we’re all tired.” And then run the same fucking race everyday. The cycle.",4760,0.99,"You’re depressed!

You’re okay, it’ll take time, but you’re okay!

What the hell is taking so long, life blows, you’re depressed again!

You woke up and got dressed today, it’s looking up from here?

SIKE, you fucking idiot, did you truly believe your depression was done with you? You’re dumber than you lead yourself to believe!

Okay, we’re okay, we’re gonna make it. I just gotta stay strong.

Oop, you fucked up once today, I’m dragging your ass back into the dark. 

OVER AND OVER AND OVER! 

Is there really only one way out? I don’t know if I wanna die, I got a brother who may need me one day. I’m tired. So tired, man.",1
https://www.reddit.com/r/depression/comments/f1yg2s/the_worst_thing_is_realising_no_one_is_coming_to/,depression,,1581403483,The worst thing is realising no one is coming to save you and you have to rescue yourself with zero motivation to do so.,4721,1,"I imagine these ridiculous scenarios in which I somehow get 'saved' from my depression by others. Like an intervention where someone comes and tries to save me.


 But now my mind is clear. No one is coming to save me. It is up to us.



But how can you mend yourself when all you want to do is destroy yourself?",1
https://www.reddit.com/r/depression/comments/ccaxvm/if_10_years_ago_someone_told_me_that_in_10_years/,depression,coolmast3r,1562967398,"If 10 years ago someone told me that in 10 years I would be routinely sitting in my room all day doing nothing to make myself a successful man but eat, sleep and use my phone/pc and sometimes go out for a lonely aimless walks, I would never believe them",4383,1,"But here I am, 24 years old man and doing exactly that.",1
https://www.reddit.com/r/depression/comments/enrs4c/do_any_of_you_feel_like_youre_lying_or_being/,depression,FerrisTheCrab,1578885041,Do any of you feel like you're lying or being melodramatic every time you try to talk about your mental health?,4348,1,"I think I may have depression, but I find it so hard to talk about, because every time I try I feel like I am just making something out of nothing. I can write out 5 messages to a friend but never send them because everything I write feels like a lie.

I managed to initiate a conversation with a friend about it just now, then immediately had to back out of it because everything i wanted to say felt like I was simply seeking attention or somehow trying to trick them. They were so supportive but I shut it down. Now I feel even more like I am just being melodramatic or attention seeking.",1
https://www.reddit.com/r/depression/comments/eb0ggo/does_anyone_else_feel_normal_one_minute_then_wish/,depression,gr33nberry,1576453910,Does anyone else feel normal one minute then wish you were dead the next?,4106,1,"I feel decent. I'm watching YouTube or I'm just browsing the internet and all of a sudden my mind is like: ""Everything in life requires effort and I'm way too exhausted to try. I have a long life ahead of me but it's too much of a bother. I don't want to live.""

Even if I'm feeling optimistic about my future and, ""what if everything really does work out the way I want it to?"" I feel like it's way too tiring to live the life I want and all I want is to sleep and do nothing.

Everyone says life is short but to me it seems so long and burdening and I don't want to do it. I think if I knew that I would inevitably drop dead in 10 years then I would feel a bit more motivated, but just knowing that it's likely that I'll have to wait 50 more fucking years before I might finally drop dead is like a giant weight on my shoulders.",1
https://www.reddit.com/r/depression/comments/dpl4bu/highfunctioning_depression_i_feel_like_im_living/,depression,D6uglh7cu,1572543379,High-functioning depression: I feel like I'm living a double life.,4070,1,"I read a lot of posts on here of people struggling with daily, debilitating depression that plagues every aspect of their lives, making it difficult to do small things like even take a shower. I feel that I am on the opposite side of the spectrum and wanted to share that it is equally as horrible.

From an outsider's perspective, I appear to be a very happy and stable individual. I have a financially secure job and I go to work every day and not only try my best but actively try to get along with others and make people laugh every day. My coworkers like me, and some look up to me. No one would think I have any problems at all. However, I feel like I am hidden behind a veil, and when I come home from work and when I am in the privacy of my home, I am in such crippling depression. I have such terrible episodes of sadness. I hate myself. I over-analyze everything stupid I do or say throughout the day and I replay it in my mind constantly and belittle myself. I don't feel proud of myself for any of my accomplishments and genuinely don't know why anyone even likes me. And yet I still get up every day, live this routine, and put on a facade like I am okay. It feels like I am living a double life that I cannot escape.",1
https://www.reddit.com/r/depression/comments/6436ul/depression_isnt_always_at_3am_when_youre_alone/,depression,mynormalheart,1491628410,"""Depression isn't always at 3am when you're alone with only the thoughts in your head. Sometimes it's at 3pm, when you're surrounded by friends in the middle of laughing."" This is high functioning depression. So many people don't get it.",4054,1,"I look normal on the outside, but that's because I try very hard to.",1
https://www.reddit.com/r/depression/comments/del3c8/i_cried_in_front_of_my_family_today_they_ended_up/,depression,ZRudd97,1570491316,I cried in front of my family today. They ended up comparing their issues to mine and tell me that other people have it worse.,3986,1,"Thank you, that really helps. Now I feel ten times worse.",1
https://www.reddit.com/r/depression/comments/c5j15l/does_anyone_else_get_extremely_bummed_out_seeing/,depression,SoulfulYam,1561541563,Does anyone else get extremely bummed out seeing people younger than them doing more with their life?,3906,0.99,"I hate being told: ""It'll get better when you're older."" No it fucking won't. I've waited for over a decade for things to get better & they haven't. It's especially not true when I see people younger than me living better, happier, & more interesting lives. Clearly that means I'm a failure & I just can't properly do this game we call life.

Just today someone I know who's younger than me just managed to find their own apartment with their SO. I can't do that now & if that doesn't scream that I'm a pathetic loser, I don't know what does.",1
https://www.reddit.com/r/depression/comments/7tso0c/i_want_to_be_alone_but_not_lonely_i_want_friends/,depression,SociallyAdeptt,1517265210,"I want to be alone, but not lonely. I want friends but hate socializing. Want success, but have no desire to be productive. I’m lost in my own conscience.",3886,1,Thank you all for the supportive messages. It’s heartwarming to know that I’m not alone. I know we can all get through this together. I love each and every single one of you ,1
https://www.reddit.com/r/depression/comments/b5lw5z/does_anyone_else_stay_up_super_late_to_avoid_the/,depression,butteredgrapes,1553607619,Does anyone else stay up super late to avoid the next day?,3876,1,"I don’t know if that makes sense. What I mean is that I stay up as late as possible wasting time because I know that if I go to sleep, I’ll wake up and have to go to school. I usually go to bed at around 3:30am and get up at 6am and it’s destroying me, I’ve been doing this for months and I’m physically weak and exhausted constantly because of it but my depression and anxiety demand it. And they always seem to get their way. 

Edit: I’m really glad that this spoke to so many people, it feels good knowing I’m not alone. Sending lots of love to you all. This isn’t easy but I believe in you ❤️",1
https://www.reddit.com/r/depression/comments/720kcr/i_wouldnt_commit_suicide_but_if_i_had_an_option/,depression,Tastylicious,1506225855,I wouldn't commit suicide but if I had an option to suddenly stop existing I would choose it,3804,1,"Does anyone else feel this way?  This has been crossing my mind a lot lately

EDIT: I just want to thank everyone for the thoughtful, kind comments I've been recieving.  It's been a nice change and I really appreciate it.  You guys are the best.  :)",1
https://www.reddit.com/r/depression/comments/g9ndgw/its_like_i_died_at_15_but_my_body_just_kept_on/,depression,thecruelandthecrazy,1588110028,"It’s like I died at 15, but my body just kept on living.",3772,1,I’m trapped inside. Does anyone else get that feeling? My memories from the past few years are shoddy at best. I think I’m losing it.,1
https://www.reddit.com/r/depression/comments/bhlyu2/had_anyone_noticed_memory_decline_from_depression/,depression,NobleChris2,1556312264,Had anyone noticed memory decline from depression?,3753,1,Just curious if anyone else affected by this problem also noticed quite a big cognitive decline. Or if anyone has noticed a cognitive decline and managed to build themselves back up to that previous cognitive level.,1
https://www.reddit.com/r/depression/comments/dbd5gr/my_therapist_died/,depression,drunkbetta,1569885807,My therapist died,3751,1,"She was only 67. She told me every so often about how she always thought she'd end up with her ex husband again and how she thought they were meant to be together in the end, I don't know if she ever got the chance to tell him how she felt.

I'm extremely shaken up, but I think she wouldn't want me to be sad for her.

In her memory I'm going to tell the people I love how I feel, give my dog a hug, and remember that she is in my corner rooting for me when I feel like nobody else is.

Edit: thanks everyone for your kind words, I feel less alone about this now. In lieu of a funeral she wanted people to donate to her dog's vet clinic because she was a huge animal lover. Maybe toss a few donations toward your local clinic or shelter to help spread her love even further",1
https://www.reddit.com/r/depression/comments/cp1ajy/does_anyone_else_have_a_constant_feeling_of_not/,depression,Nyx13Love,1565581267,does anyone else have a constant feeling of not fitting in or belonging anywhere?,3678,1,"i feel this way around everyone, friends, family, coworkers, anywhere i go. i just always feel like i’m in the background. but at the same time i like going unnoticed so i don’t have to talk to anyone and be in the spotlight..",1
https://www.reddit.com/r/depression/comments/f791jw/the_scary_part_about_having_depression_is_when/,depression,Sin2thevoid,1582308366,The scary part about having depression is when you start to feel down it's hard to know if it's a temporary reaction to life or the start of a relapse,3624,1,Basically what the title says and my current situation.,1
https://www.reddit.com/r/depression/comments/cn5vlj/the_worst_part_of_depression_is_waking_up_and_the/,depression,no-money,1565213742,"The worst part of depression is waking up and the first thought that pops in your head is how shitty you feel, alone and already struggling to get through the day before it’s even started.",3617,1,"I can’t even remember the last time i woke up excited for anything.

edit: Wanted to thank everyone for their kind words and sharing your own stories. Definitely glad to have this community it helps to know we aren’t alone even though it may feel that way.",1
https://www.reddit.com/r/depression/comments/86lbej/do_you_ever_just_stop_dead_in_the_middle_of/,depression,NordyNed,1521846255,Do you ever just stop dead in the middle of whatever you're doing and feel a great wave of existential dread/self-hatred,3603,1,"Happens to me a lot. Cooking, walking to class, brushing my teeth...sometimes I just stop for like a minute, feel a tremendous sense of self-hatred and suicidal ideation, and then continue on as if nothing ever happened.",1
https://www.reddit.com/r/depression/comments/brsy1y/does_anyone_have_a_period_where_they_feel_really/,depression,,1558581704,"Does anyone have a period where they feel really motivated and see things clearly, only to crash even harder the more you try to better yourself, feeling even more depressed than you were originally?",3552,1,"It feels like the harder I try to better myself, the harder it pushes back.",1
https://www.reddit.com/r/depression/comments/8mcrt9/anyone_else_ever_feel_like_the_old_you_died_years/,depression,Conurekid,1527394746,"Anyone else ever feel like the “old you” died years ago, and now you’re just limping along as someone you really can’t stand?",3521,1,"Like, the old me wasn’t even that great either but damn ",1
https://www.reddit.com/r/depression/comments/gea6mo/it_sucks_realizing_youre_no_ones_best_friend/,depression,Ahah_Thatscool,1588755503,It sucks realizing you're no one's best friend,3470,1,"I mean, it's not their fault. I can't really be mad at other people for having better connections with another person. I just wish I had someone I could call my best friend, and have them do the same...",1
https://www.reddit.com/r/depression/comments/cpvwhh/is_anyone_else_strangely_sick_of_being_high/,depression,dinosaur_nads,1565744112,Is anyone else strangely sick of being high functioning?,3458,0.99,I know that the fact that I can brush my teeth and shower each day and show up to work each day is a blessing with my depression. But I’m also sick of constantly feeling like I’m about to break. I hate nearly downing my pills each night only to wake up the next day to plaster a fake as smile on my face and go to work. Each night I think to myself I can’t go on like this and each day I do. Part of me just somehow wishes I completely gave up and just hit rock bottom. I don’t know. Anyone else feel the same?,1
https://www.reddit.com/r/depression/comments/b7q1kc/becoming_a_regular_at_a_local_coffee_shop_changed/,depression,luxcsia,1554081212,Becoming a regular at a local coffee shop changed my life,3443,0.99,"I was depressed, failing school, etc and I decided I should do my homework at a coffee shop one day. I went in and the owner was super nice and asked me if I wanted to join the rewards program and I was really craving community at this point and I was super excited. 
I kept coming back to the shop to do my homework and the owner and the baristas would always welcome me and they were always happy to see me. I started to get to know everybody there very well and now I consider them all friends. 
I found that when depressed having different communities helps a lot, and it turns out a lot of the other regulars at coffee shops also are depressed or have other mental illnesses. 
A two dollar drink can let you stay there for a few hours and by being nice to everyone around you and being somewhat productive on work it can be a really great place to have",1
https://www.reddit.com/r/depression/comments/gocxne/to_people_who_say_you_can_always_talk_to_me/,depression,The-Nights-King,1590152195,to people who say "you can always talk to me",3329,0.99,no I fucking can't. you really think I can just drop "I want to kill myself and have for 6 years" on someone at 1 am and expect it to go over well? I'm not about to put that on anyone,1
https://www.reddit.com/r/depression/comments/d9f2m4/when_you_realize_that_you_have_an_incredibly_easy/,depression,LilVigilante,1569503193,When you realize that you have an incredibly easy life but you’re screwing It up for yourself,3326,1,My life is objectively very easy but my depression makes it all feel like a struggle,1
https://www.reddit.com/r/depression/comments/ghdi7l/people_that_arent_depressed_exist_and_its_fuckin/,depression,future-googler-maybe,1589187104,People that aren't depressed exist and it's fuckin insane to me.,3310,0.99,"Like ???


I posted on AskReddit asking non-depressed people how they felt and I'm shocked. Not sure what I expected though.


You exist in this hellhole and you're just like... Chill with it? Like I'm so happy for these people but it's mindblowing! Like I have never known a time that I didn't experience severe recurring depression so it's just fuckin crazy that these people are real? One even said they don't understand how people can be depressed for seemingly no reason. Like I wish so much I could say the same.


Like logically I knew they must exist but it's still just unfathomable in my mind. It kinda makes me sad that I don't understand them just as much as they don't understand me. But I'm glad at least someone is happy in life. Idk man.",1
https://www.reddit.com/r/depression/comments/dsgdf3/does_anyone_else_stay_up_to_3am_every_night/,depression,Ren_Rosemary,1573076091,Does anyone else stay up to 3AM every night wanting to die only to get up for school and start the cycle over again every day?,3275,0.99,I'm so tired and I hate everything.,1
https://www.reddit.com/r/depression/comments/e00pxq/i_wish_i_could_say_i_was_depressed_the_same_way_i/,depression,hydrationahoy,1574456752,I wish I could say "I was depressed" the same way I say "I was sick" to explain my absence,3273,1,"I'm so tired of making excuses. I am sick, just in my head.",1
https://www.reddit.com/r/depression/comments/cqqe91/2_years_since_i_dropped_out_of_college_due_to/,depression,EffYouAnxiety,1565907316,"2 years since I dropped out of college due to anxiety and depression, I finally signed back up for classes yesterday.",3213,0.99,"I finally did it guys!!!!! 2 years!! 

I was so depressed 2 years ago I started skipping classes, I failed every single class I was in. My GPA dropped to a 1.7. I lost my financial aid, which I couldn't go back the next semester without.

I spent the last 2 years, becoming more and more depressed because I couldn't afford to go back and I ruined my life over depression. 

But I finally did it!!!! (with the consistent encouragement of my boyfriend who told me hes going to keep on top of my ass and I'm not allowed to skip class) I still have a year and a half left for my associate's because of how much I failed but it's a start.

Edit: I cant believe how many people replied to this!! Thank you all so much for encouraging me, to know I had 100+ people comment to tell me how proud they are makes me even more motivated to do well this semester. 

Also to all the people who said this post gave them a little kick in the ass to go back, were all going to do amazing :)",1
https://www.reddit.com/r/depression/comments/gt5txv/anyone_keep_switching_from_admitting_to_yourself/,depression,HolyFruitSalad_98,1590832109,Anyone keep switching from admitting to yourself that you have depression to invalidating yourself into thinking you were just playing victim?,3189,1,"I know I have issues. But I go through manic mood swings, and while on the depressive end I feel like absolute shit, when I'm out of that phase and feel somewhat ""normal"" again I tell myself I greatly exaggerated the effect in my mind. It doesn't help that my self loathing won't let me admit that I have depression because I keep thinking I don't deserve to be depressed. So I invalidate myself and continue life until the next phase hits, and the cycle continues.",1
https://www.reddit.com/r/depression/comments/g3ljni/you_ever_feel_bad_for_not_checking_up_on_somebody/,depression,fireflies123_,1587235239,You ever feel bad for not checking up on somebody then you realise the phone goes both ways and they aren't checking up on me are they?,3155,1,,1
https://www.reddit.com/r/depression/comments/cd6d58/does_anyone_else_get_really_happy_and_motivated/,depression,Idekanymore20,1563157720,"Does anyone else get really happy and motivated for a few hours to a few days, just to fall off the edge again?",3099,1,It feels like I'm on a rollercoaster with 80% super lows and 20% kinda highs..,1
https://www.reddit.com/r/depression/comments/btcc3j/after_1_suicide_attempt_and_one_overdose_i/,depression,10yes4life,1558929113,"After 1 suicide attempt, and one overdose, I GRADUATED!!!!",3072,0.98,"I MADE IT. FUCK EVERYONE WHO PUT ME DOWN. FUCK THE BULLIES, FUCK THE CLIQUES, I DID IT. But more importantly, THANK YOU to everyone who kept me going. It brings me to tears thinking about how thankful I am to be here today because of my family, friends, and the wonderful people on this subreddit who helped me when I was down. I feel so immensely proud and happy right now because of my achievements. To all the people struggling through high school and college, there is light at the end of the tunnel. I LOVE YOU ALL!!!!


Edit: wow thanks for all the awards, love, and support!",1
