url,subreddit,author_name,created,title,score,upvote_ratio,content,result
https://www.reddit.com/r/NeutralTalk/comments/agd3tw/theresa_mays_brexit_deal_just_got_rejected_by_an/,neutraltalk,robincb,1547614095,Theresa May's brexit deal just got rejected by an overwhelming majority in the british house of commons,12,0.93,"https://www.bbc.com/news/amp/uk-politics-46885828

Do you think this is a good thing? What socio-economic effects do you foresee, and what do you think the final result will be? No deal? Or no brexit?",0
https://www.reddit.com/r/NeutralTalk/comments/ag8yrv/why_is_the_new_gillette_ad_offending_so_many/,neutraltalk,catfishingSince1995,1547590881,Why is the new Gillette ad offending so many people?,29,0.84,"Gilette came out with a new ad which takes a slight lean on the left. The way I saw it, it was just generic- violence is bad, it's okay for boys to cry, etc. But some people on the internet, who are more right winged, are losing their shit over it. Their videos on YT came off as an impulsive rage rather than a critical explanation as to why it offended them. One recurring point was that it was ""anti-men"". I, personally, didn't see as an attack on men. Yes it wasn't catering to men like their other ads but it wasn't definitely attacking them viciously.

I'd like to add that I'm not a US resident. Things there are different from where I live. So if a come off as ignorant, I apologise. One can read all the news articles and watch many videos but noone can be fully knowledgeable until they experience it first hand.

So I would really appreciate a critical explanation as to why the ad is offensive and if people are rightfully offended.

Source:
Gillette ad: https://youtu.be/UYaY2Kb_PKI
Timcast's video: https://youtu.be/CCT4nYIpRSs
The Quartering: https://youtu.be/J_TQl9IwRrU",0
https://www.reddit.com/r/NeutralTalk/comments/afhj3b/differing_political_viewpoints/,neutraltalk,Stryker877,1547397537,Differing Political Viewpoints,11,0.93,"Hey everybody, not sure if this is the best place to post this but if there's somewhere better somebody could point me to I'll gladly repost there instead.

The main question I want to ask is what sort of news sources do you guys find the best and most reliable? I'm a mid-20s white male who leans notably progressive. I grew up in a conservative household without having much of a grasp on what politics meant, and since having come into my own have ended up moving a good deal left of my family and most people around me. I enjoy The Young Turks and follow and agree with most of Bernie Sanders' positions as an example. But the more involved and interested I get in politics, the more aware I am that I'm in an echo chamber. I see a lot of media that supports what I already believe and not much from opposing viewpoints that don't seem, to me, rather radical. Especially in today's climate where everything is more hyper-politicized and it's so easy to find only people that only agree with you and cut the rest out as ""fake news"" so to speak.

I fully admit that I have a lot to learn and I think that neither side is the absolute paradigm of what a party should be. I'm mostly really curious and eager to try and break away from my bubble. Not necessarily to change my viewpoints, but at least to see what the other side of the aisle sees. I'm also happy to have a discussion with anybody regarding policy positions and I feel like this would be a good place to at least start making a more nuanced opinion of the world at large. Thanks in advance, and if there's somewhere better to post I'll be more than happy to take it there!",0
https://www.reddit.com/r/NeutralTalk/comments/af7vmy/why_does_operating_with_a_surplus_to_eliminate/,neutraltalk,afail77,1547332442,Why does operating with a surplus to eliminate the government shut downs never considered?,4,0.67,It's my understanding that if we reached a point where the government spent less than it took in that the government would never run out of money and would not shut down. Why is this option never considered? ,0
https://www.reddit.com/r/NeutralTalk/comments/ae6igd/part_5_openbazaar_and_institution_technology_is/,neutraltalk,AliRastgar,1547066926,Part 5 : OpenBazaar And Institution – Technology Is Changing Our Value Systems,1,0.56," “ ‘Economics is not a morality play’ Krugman, Nobel laureate in economy said in an interview. Krugman is not a technologist but it’s not hard to imagine how he would react if he was asked: what about technology? The reason for societies is the division of labour which, in turn, is the building block of the economy. Economy, indeed, is the most fundamental layer of any society. It is said that the market addresses the most basic human needs. And things like morality belong to higher levels. Bullshit. At least that is what I will try to argue: Morality is far more fundamental than that. Morality doesn’t address human basic needs you might say. Again bullshit (I would use stronger words if the article wasn’t about morality).  
 How can we change the values of society? What does it have to do with economic value? Sharing economy, for instance, changes the notion of value in the economy. It’s not that people won’t spend but they will buy services that enable them to share stuff instead of producing them. What is the role of tools we build? Technology enables us to have such a weird economy which potentially can address many of our environmental concerns. Then what is the role of technology in morality? Technology helps us to redefine value, moral value. And finally how will it affect the structure of firms, from small firms to states? ”

.

This article has been written for Bitcoin's 10th birthday. You can read the full article here:

https://bitrump.org/2019/01/09/tech-changing-value-systems/",0
https://www.reddit.com/r/NeutralTalk/comments/a8tt6u/as_more_people_are_indicted_by_mueller_without/,neutraltalk,,1545590792,"As more people are indicted by Mueller, without providing a 'smoking gun' regarding the president's involvement in criminal activity, does the likelihood of his innocence go up?",10,0.78,"That is, to me it seems like the more people Mueller talks to and strikes deals with, the more likely it would be that one of them would provide something actionable against the president. However, I've also heard people say that an investigation of this kind takes time, and that evidence is still being gathered that the public may not yet be aware of.  Which situation do you think is more likely, and why?

EDIT: 

Just to clarify, what I'm asking is, essentially, if there were a 'smoking gun' type of evidence of criminal activity on the part of the president, wouldn't it have come out by now?",0
https://www.reddit.com/r/NeutralTalk/comments/a6dotd/part_4_openbazaar_and_institution_open_letter_no2/,neutraltalk,AliRastgar,1544891144,Part 4 : OpenBazaar And Institution - Open Letter no.2,1,0.54," This is the second open letter to readers of my articles and the first open letter published on November 26. Those who possibly found the first letter disturbing. Those who thought to themselves, outright, it was wrong.  
 Before posting my first letter I paused for a while, I was about to create an image of myself which would last forever. Then I thought I wasn’t creating anything. That’s who I am. Normally it’s not good that exposing who you really are, damages you, but that’s how things are.  
 The aim of my articles was to encourage debates on topics relevant to the whole world. But I understand that the real me is on the way. So I decided to write this letter.  
 In such an interconnected, complex world we live in, no individual, no single idea can save the world. Put aside, individuals. Ideas should be discussed, rejected, developed and transformed. Ideas which have been developed collectively will lead to lasting social reforms. Ignore individuals. Ignore their mistakes, their misjudgments. Let the debate begin.  
 For a long time prison for me was something to be forgotten. It took years to realize the opposite was true. The lesson was in fact far too valuable to be forgotten. Some months ago I noticed that Mr Gauke, UK Secretary for Justice had expressed his intentions for prison reform. As a person who had experienced life on both sides of prison doors, I thought it was time to bring the topic to the foreground. Mr Gauke had mentioned reforming one side of the prison doors. There are, in fact, two sides to each door and both sides of prison doors need reform. And it’s not limited to the UK. Global problems need global solutions.   
 For me, civil disobedience wasn’t an easy choice. I wouldn’t do that if I hadn’t clearly and firmly rejected violent solutions and protests in my previous articles. Then protests in France began. It wasn’t entirely peaceful and it achieved as much as protests in this kind could achieve: A few laws were overturned. And it urged me to write this letter to make it clear that no profound reform is ever achieved by violence. No violent solution exists for global problems our world faces. We need no more destruction. Destruction, of the environment and global stability among other things, are being done on a daily basis. Construction, however, based on global collaboration is the solution.

And lastly, I should apologize to those who found my first letter disturbing. I posted that for what I believed to be a good cause, globally.   

&#x200B;

[This is the link to other articles.](https://bitrump.org/category/articles/)",0
https://www.reddit.com/r/NeutralTalk/comments/a2g9ah/does_marijuana_use_lead_to_a_sevenfold_increase/,neutraltalk,RomanNumeralVI,1543807350,Does marijuana use lead to a seven-fold increase in violent crimes for some (but not most) people? A 50 year scientific study claims that it does.,4,0.6,"Here is an article from Psychology Today: [Marijuana Use Increases Violent Behavior
50-year study finds causal link between cannabis and subsequent violent behavior. ... In conclusion, the results show that continued cannabis use is associated with a 7-fold greater odds for subsequent commission of violent crimes.](https://www.psychologytoday.com/us/blog/the-new-brain/201603/marijuana-use-increases-violent-behavior).

I’m sure that there are contrasting opinions, the point is that there is a scientific *debate* if marijuana induces violence *in some people*. For this study, **80% of the pot smokers never became violent criminals**.

The linked article seems to me to be balanced and to be framed in a neutral (evidence-based) way. It reviews and considers the opposing theories and their supporting evidence.",0
https://www.reddit.com/r/NeutralTalk/comments/a2e9yb/free_college_tuition/,neutraltalk,prozak82,1543794820,Free college tuition,2,0.58,"so I think its definitely a good idea to make sure that everyone gets the opportunity to get further education if they want it, but I think a better way to do it would be to make it merit based instead of just giving it to everyone. so like if you have a 4.0 gpa your next semesters tuition is completely paid for, and then you could scale it from there - a 3.0 gpa would be half paid for and then 2.0 and below youd have to pay for all of it. this makes sure that smart people that earn it get the opportunity to go to college, while not forcing me to pay for johnny fratboys ""education"" that consists of getting smashed every weekend and collecting herpes.

&#x200B;

you guys think this would be something good to spend our money on? I cant see how having a bunch of smart people could be a bad thing, and it would also help relieve the debt burden many students find themselves in.   ",0
https://www.reddit.com/r/NeutralTalk/comments/a0qwtt/does_h_ate_speech_even_exist/,neutraltalk,RomanNumeralVI,1543318240,Does h ate speech even exist?,0,0.44,"As far as I know hate speech laws do not exist.

Actions break laws, speech generally does not. When is speech illegal if it does not incite illegal violence?",0
https://www.reddit.com/r/NeutralTalk/comments/a0mswv/what_is_the_probably_cause_of_the_gm_plants/,neutraltalk,tenemu,1543290713,What is the probably cause of the GM plants closing and laying off workers?,9,0.91,"https://www.news5cleveland.com/news/local-news/general-motors-lordstown-plant-to-stop-production-sources-say

I see some on Reddit blaming the tariffs while others say it's because they are changing what cars they make. The article says in April that GM is blaming the Cruze sales for an employee reduction then. ",0
https://www.reddit.com/r/NeutralTalk/comments/a0jcju/part_2_openbazaar_and_institution_an_open_letter/,neutraltalk,AliRastgar,1543267876,Part 2 : OpenBazaar and Institution : An Open Letter,2,0.75," This is the second part in a series regarding OpenBazaar and institution. ([This](https://bitrump.org/2018/11/20/openbazaar-and-institution-the-cost-of-the-central-authority/) is the link to the first article.)  
 In the first article, I discussed the role of central authorities in the future. What about the justice system? What is the role of society? This is an open letter to UK Secretary of State for Justice regarding my past experiences but is not limited to the UK:

https://www.change.org/p/uk-justice-department-an-open-letter-to-uk-secretary-of-justice  
 ",0
https://www.reddit.com/r/NeutralTalk/comments/9zf9jd/what_topics_should_be_avoided_during_thanksgiving/,neutraltalk,Srules,1542931223,What topics should be avoided during Thanksgiving?,5,0.74,"Hi everyone, I tried to put together what I thought would be a useful guide to approaching a politically divided Thanksgiving.

[https://medium.com/@confidist/5-tips-for-civility-at-a-politically-divided-thanksgiving-7190dfdeb457](https://medium.com/@confidist/5-tips-for-civility-at-a-politically-divided-thanksgiving-7190dfdeb457)

However, I am curious what the members of /NeutralTalk are going to be avoiding today. I point out some easy ones to avoid like Abortion, or topics that might bring up personal trauma. In your experience what has been the trickiest topics to navigate in an open setting? Looking forward to participating in the discussion! Kind regards -Nicholas",0
https://www.reddit.com/r/NeutralTalk/comments/9zcnwt/my_take_on_the_populist_tides_and_socalled/,neutraltalk,,1542907681,My take on the populist tides and so-called polarization of politics,6,0.88,"Everyone who doesn't have their heads in the sand will admit there's a wave on both sides of rebellion against the status quo. For that reason, we got Trump (and a bunch of other stuff).

Everyone talks about this as though the enemies are the government. That's who we say they're rebelling against.

What if it's the news itself? We're rebelling against the private sector, not the public sector. Everyone that voted for Trump as an 'f u' vote, for instance, wanted to stick it to the people that write these absurd headlines, demean entire classes of people (which they may well be a part of), and so on. And then, you might see it as an 'us vs them' rebellion or a polarization. That's the other news story.

But is that really true? Or is that the press controlling the narrative, directing everyone away from themselves?

Not that the press is the only aspect of the private sector that people wanted to rebel against. Surely, the issue with jobs is due in part to how US corporations have decided to conduct business. You can say it's just them pursuing all ends while staying within the law, but that would be your American bias talking -- we are more litigious than anyone. Other people believe (and sometimes prove) that different types of business practices can be both more benevolent and more profitable. In a round about way, the voters want to rebel against the big wigs at those major corporations, not the doofus in office that couldn't possibly write enough laws to slow them down.

People hate what big money does... That's what everyone wants to rebel against, not the government, not the opposing party.",0
https://www.reddit.com/r/NeutralTalk/comments/9z3k7r/the_cost_of_the_central_authority/,neutraltalk,AliRastgar,1542838505,The cost of the central authority,4,0.75,"In a series of articles I will try to encourage debates regarding the effect of free decentralized platforms such as OpenBazaar on societies and governance in general. This is the first article which is about social institutions:  

""... Institutions may reach to a point, says Locke (one of the main contributors to the theory of the social contract, not an anarchy) where revolution becomes an obligation. The social contract states that governance is a service society should pay for by abandoning a portion of their freedoms. What specifies the price? Can I say, at some point, well no thank you? ""

This is the link to the full article:
https://bitrump.org/2018/11/20/openbazaar-and-institution-the-cost-of-the-central-authority/
Thanks
",0
https://www.reddit.com/r/NeutralTalk/comments/9vnuvx/america_needs_to_address_its_gun_violence_problem/,neutraltalk,wyskiboat,1541823324,"America needs to address its gun violence problem. Are psychadelics, social media, and social programs a better solution than further restricting gun ownership?",16,0.76,"We absolutely have to start doing \*something\* about this problem. If we're going to be the only country with liberal gun ownership rights, we need to start being much more active in solving our people's problems so these things stop happening. 

How? My thoughts:

(1) Much more pervasive tracking of mental health issues, not for immediate enforcement/denial purposes, but for outreach purposes.

http://www.digitaljournal.com/life/health/ai-to-search-social-media-to-predict-suicides/article/511220

(2) Accelerate testing of Psychadelics to treat PTSD and depression. 

https://www.webmd.com/mental-health/news/20180918/psychedlic-drugs-to-treat-depression-ptsd

(3) Expand social nets and improve distribution of wealth across the board. The 'every man for himself' model is easy to understand, but it is not the most efficient means to vibrant, strong communities and nations. Every country with laws governing businesses is 'socialistic' to varying degrees. 

We need to decide whether 'our fellow Americans' are people we care about, or not. If not, the mass shootings will not only continue, but grow. 

There are other steps which can be taken, but most of them will infringe on gun possession, concealed carry, open carry and other '2nd Amendment' issues that will be fought tooth and nail by the NRA.

So, if we 'cannot do anything about' guns in America, then we need to start doing something 'about Americans' to protect and look after their mental health. We need to do more for our veterans, our poor, and people who are suffering from life challenges. 

Countries like Switzerland, which has the next highest rate of gun ownership, has 50% as many guns per capita, and the US has 500% more homicides by gun per capita. Switzerland does not have the 'social gun culture' America has. Guns and violence are not 'sexualized' there, as they are here, and the country also has a much more socially oriented system for the care of it's people (healthcare, taxation, social programs, etc). Despite this 'socialization', the Swiss are, per capita, TWICE as well off as Americans.

http://www.nationmaster.com/country-info/compare/Switzerland/United-States

On that basis, we either need to get rid of guns in America (I'm not a fan of that idea), or create a much better care structure for Americans, improving social safety nets, and we must stop bankrupting our populace with absurd business/insurance-centric healthcare costs. There is zero indication that this would harm GDP, employment rates, medical innovation and treatment, or the overall economy. Much the opposite. The current environment of 'everyone is on their own, here's your gun, protect the unborn, to hell with everyone after that' is not working, and failure to take meaningful steps to improve the situation will result in more of the same...",0
https://www.reddit.com/r/NeutralTalk/comments/9uqbbi/i_dont_get_the_need_to_diversify_everything_ie/,neutraltalk,MrEpicDwarf,1541553869,I don't get the need to "diversify" everything. (I.e. identity politics),8,0.59,"So as obvious as it may be, for the past few years there has been groups of people pushing agenda to get more of (x) into (x) thing. This has happened across multiple mediums such as: games, business, movies, television, ect.

My issue this being I don't understand the need to get more women ceos, or more people of color in various positions. I only care if they fit the job.

Also I'm tired of identity politics flooding my hobbies, it's happened with DnD, comics and now Witcher. ",0
https://www.reddit.com/r/NeutralTalk/comments/9t13yr/modern_democratic_elections_should_consider/,neutraltalk,TheScoutman,1541037025,Modern democratic elections should consider rejection rates in a direct and effective manner,13,0.85,"My thoughts on this matter were stirred by the recent brazilian presidential elections. To those not familiar with it, it was similar to the last US presidential election in the sense that most people were dissatisfied with the candidates they had to choose from, the two candidates that made it to the final round had extremely high rejection rates, but still the race came down to a puppet of the corrupt former ruling party running a populist campaign centered entirely around the poorer states, and a bigot demagogue with fascist inclinations running a campaign entirely focused on slandering the previous government and making vague promises to fix everything.  

While there were many contributing factors that lead to such a situation, including easy targets like a perceived lack of political education and the use of manipulative propaganda and ""fake news"", I believe the crux of the problem is an universal flaw of large democracies: Appealing to obstinate minorities is more valuable than appeasing a freethinking majority.  

Earlier in this text I mentioned a similarity between the political situation in the US and the political situation in Brazil, now I need to mention some key differences. The two main ones is that Brazil has a multi-party political system and that voting is compulsory. I am favorable to both of those even if they have their flaws, mainly because they should discourage polarization and voter apathy, but they have shown themselves to be insufficient. 
 
Simply put, both of the candidates that made it to the final round had plenty of things about them that pissed off almost all of the open-minded voters, but they also secured themselves a significant number of closed-minded voters to the point where it became extremely unlikely any other candidate could make it to the final round, since they would need to rely on being a consensus reached by a large majority of open-minded voters, which naturally wouldn't happen since open-minded voters are different and will vote for different people based on their different opinions on many different political matters.  

So then the two most hated candidates made it to the final round and the hard choice of the lesser evil was forced upon the open-minded voters and at that point the elections were no longer about realpolitik or even ideologies, they were about a very polarized competition and personal moral dilemmas people had to solve to be able to live with their choice. Such a depressing experience only leads to even more voter apathy.  

This is a trend I think will only grow around the world in the information era, and solutions need to be found if democracy is to sustain itself. Going back to the title of this thread, I wonder if this is something that could work, perphaps if the first round of Brazilian elections were about eliminating the most unnaceptable candidates instead of narrowing it down to the initially most supported ones, perphaps mechanisms like populism and extremism would stop being such powerful tools.  

tl;dr
polarization is bad for democracy, early rounds of votes should be used to make the extremes eliminate each other so closed-minded voters are the ones who are forced to compromise or abstain in the final round.",0
https://www.reddit.com/r/NeutralTalk/comments/9sw5zz/how_would_president_hillary_clinton_have_dealt/,neutraltalk,SolarAnomaly,1540994963,How would President Hillary Clinton have dealt with the killing of journalist Jamal Khashoggi?,6,0.62,I'm genuinely curious and am not trying to imply anything.,0
https://www.reddit.com/r/NeutralTalk/comments/9sgyza/what_are_some_good_resources_to_see_how/,neutraltalk,Carroteyeisamyth,1540874023,What are some good resources to see how candidates stand on environmental views?,16,1,"I know the NRA has a score card for Guns, NAACP has for their equal rights. LCV is for environment? https://www.lcv.org/ Is there anything else or other reliable or creditable organizations that rate candidates on other things? ",0
